title,authors,publish_date,journal_name,doi,citations
HIV Knowledge and Associated Factors among Internet-Using Men Who Have Sex with Men (MSM) in South Africa and the United States,"Bradley H. Wagenaar, Patrick S. Sullivan, Rob Stephenson",published 12 Mar 2012,PLOS ONE,https://doi.org/10.1371/journal.pone.0032915,50
Remotely Piloted Aircraft Systems as a Rhinoceros Anti-Poaching Tool in Africa,"Margarita Mulero-Pázmány, Roel Stolper, L. D. van Essen, Juan J. Negro, Tyrell Sassen",published 08 Jan 2014,PLOS ONE,https://doi.org/10.1371/journal.pone.0083873,244
"Evaluation of a community-based HIV test and start program in a conflict affected rural area of Yambio County, South Sudan","Cecilia Ferreyra, Laura Moretó-Planas, Fara Wagbo Temessadouno, Beatriz Alonso, Buai Tut, Victoria Achut, Mohamed Eltom, Endashaw M. Aderie, Vicente Descalzo-Jorro",published 12 Jul 2021,PLOS ONE,https://doi.org/10.1371/journal.pone.0254331,7
Network analysis of regional livestock trade in West Africa,"Valerie C. Valerio, Olivier J. Walther, Marjatta Eilittä, Brahima Cissé, Rachata Muneepeerakul, Gregory A. Kiker",published 14 May 2020,PLOS ONE,https://doi.org/10.1371/journal.pone.0232681,35
"A Decline in New HIV Infections in South Africa: Estimating HIV Incidence from Three National HIV Surveys in 2002, 2005 and 2008","Thomas M. Rehle, Timothy B. Hallett, Olive Shisana, Victoria Pillay-van Wyk, Khangelani Zuma, Henri Carrara, Sean Jooste",published 14 Jun 2010,PLOS ONE,https://doi.org/10.1371/journal.pone.0011094,113
"Linkage to Care and Treatment for TB and HIV among People Newly Diagnosed with TB or HIV-Associated TB at a Large, Inner City South African Hospital","Yara Voss De Lima, Denise Evans, Liesl Page-Shipp, Antonia Barnard, Ian Sanne, Colin N. Menezes, Annelies Van Rie",published 16 Jan 2013,PLOS ONE,https://doi.org/10.1371/journal.pone.0049140,20
“The care is the best you can give at the time”: Health care professionals’ experiences in providing gender affirming care in South Africa,"Sarah Spencer, Talia Meer, Alex Müller",published 12 Jul 2017,PLOS ONE,https://doi.org/10.1371/journal.pone.0181132,17
Cost-Effectiveness of Long-Lasting Insecticide-Treated Hammocks in Preventing Malaria in South-Central Vietnam,"Chantal M. Morel, Ngo Duc Thang, Annette Erhart, Nguyen Xuan Xa, Koen Peeters Grietens, Le Xuan Hung, Le Khan Thuan, Pham Van Ky, Nguyen Manh Hung, Marc Coosemans, Umberto D'Alessandro, Anne Mills",published 11 Mar 2013,PLOS ONE,https://doi.org/10.1371/journal.pone.0058205,17
A food systems approach and qualitative system dynamics model to reveal policy issues within the commercial broiler chicken system in South Africa,"Kevin Queenan, Soledad Cuevas, Tafadzwanashe Mabhaudhi, Michael Chimonyo, Bhavani Shankar, Rob Slotow, Barbara Häsler",published 29 Jun 2022,PLOS ONE,https://doi.org/10.1371/journal.pone.0270756,3
"Eye care service utilization and associated factors among older adults in Hawassa city, South Ethiopia","Efa Derecha Morka, Betelhem Temesgen Yibekal, Mebratu Mulusew Tegegne",published 16 Apr 2020,PLOS ONE,https://doi.org/10.1371/journal.pone.0231616,17
"Comparative Phylogeography in Rainforest Trees from Lower Guinea, Africa","Myriam Heuertz, Jérôme Duminil, Gilles Dauby, Vincent Savolainen, Olivier J. Hardy",published 08 Jan 2014,PLOS ONE,https://doi.org/10.1371/journal.pone.0084307,36
Use of Medical Services and Medicines Attributable to Diabetes in Sub-Saharan Africa,"Jonathan Betz Brown, Kaushik Ramaiya, Stéphane Besançon, Paul Rheeder, Clarisse Mapa Tassou, Jean-Claude Mbanya, Katarzyna Kissimova-Skarbek, Eva Wangechi Njenga, Eva Wangui Muchemi, Harrison Kiambuthi Wanjiru, Erin Schneider",published 12 Sep 2014,PLOS ONE,https://doi.org/10.1371/journal.pone.0106716,23
"67,000 years of coastal engagement at Panga ya Saidi, eastern Africa","Patrick Faulkner, Jennifer M. Miller, Eréndira M. Quintana Morales, Alison Crowther, Ceri Shipton, Emmanuel Ndiema, Nicole Boivin, Michael D. Petraglia",published 26 Aug 2021,PLOS ONE,https://doi.org/10.1371/journal.pone.0256761,17
An Estimate of the Incidence of Prostate Cancer in Africa: A Systematic Review and Meta-Analysis,"Davies Adeloye, Rotimi Adedeji David, Adewale Victor Aderemi, Alexander Iseolorunkanmi, Ayo Oyedokun, Emeka E. J. Iweala, Nicholas Omoregbe, Charles K. Ayo",published 13 Apr 2016,PLOS ONE,https://doi.org/10.1371/journal.pone.0153496,125
Hospital-associated methicillin-resistant,"Liliwe L. Shuping, Lazarus Kuonza, Alfred Musekiwa, Samantha Iyaloo, Olga Perovic",published 16 Nov 2017,PLOS ONE,https://doi.org/10.1371/journal.pone.0188216,17
Exploring the promise and reality of ward-based primary healthcare outreach teams conducting TB household contact tracing in three districts of South Africa,"Candice M. Chetty-Makkan, Daniel deSanto, Richard Lessells, Salome Charalambous, Kavindhran Velen, Sewele Makgopa, Dumile Gumede, Katherine Fielding, Alison D. Grant",published 13 Aug 2021,PLOS ONE,https://doi.org/10.1371/journal.pone.0256033,7
An overview of the quality assurance programme for HIV rapid testing in South Africa: Outcome of a 2-year phased implementation of quality assurance program,"Selamawit Alemu Woldesenbet, Mireille Kalou, Dumisani Mhlongo, Tendesayi Kufa, Makhosazana Makhanya, Adeboye Adelekan, Karidia Diallo, Mahlatse Maleka, Beverley Singh, Bharat Parekh, Amanda Mohlala, Peter T. Manyike, Tim J. Tucker, Adrian J. Puren",published 26 Sep 2019,PLOS ONE,https://doi.org/10.1371/journal.pone.0221906,6
Virologic Failure of Protease Inhibitor-Based Second-Line Antiretroviral Therapy without Resistance in a Large HIV Treatment Program in South Africa,"Julie H. Levison, Catherine Orrell, Sébastien Gallien, Daniel R. Kuritzkes, Naishin Fu, Elena Losina, Kenneth A. Freedberg, Robin Wood",published 13 Mar 2012,PLOS ONE,https://doi.org/10.1371/journal.pone.0032144,59
"Microliths in the South Asian rainforest ~45-4 ka: New insights from Fa-Hien Lena Cave, Sri Lanka","Oshan Wedage, Andrea Picin, James Blinkhorn, Katerina Douka, Siran Deraniyagala, Nikos Kourampas, Nimal Perera, Ian Simpson, Nicole Boivin, Michael Petraglia, Patrick Roberts",published 02 Oct 2019,PLOS ONE,https://doi.org/10.1371/journal.pone.0222606,45
"How people used ochre at Rose Cottage Cave, South Africa: Sixty thousand years of evidence from the Middle Stone Age","Tammy Hodgskiss, Lyn Wadley",published 26 Apr 2017,PLOS ONE,https://doi.org/10.1371/journal.pone.0176317,30
"Integration of point-of-care screening for type 2 diabetes mellitus and hypertension with COVID-19 rapid antigen screening in Johannesburg, South Africa","Alana T. Brennan, Beatrice Vetter, Mohammed Majam, Vanessa T. Msolomba, Francois Venter, Sergio Carmona, Kekeletso Kao, Adena Gordon, Gesine Meyer-Rath",published 07 Jul 2023,PLOS ONE,https://doi.org/10.1371/journal.pone.0287794,1
"Young people’s data governance preferences for their mental health data: MindKind Study findings from India, South Africa, and the United Kingdom","Solveig K. Sieberts, Carly Marten, Emily Bampton, Elin A. Björling, Anne-Marie Burn, Emma Grace Carey, Sonia Carlson, Blossom Fernandes, Jasmine Kalha, Simthembile Lindani, Hedwick Masomera, Lakshmi Neelakantan, Lisa Pasquale, Swetha Ranganathan, Erin Joy Scanlan, Himani Shah, Refiloe Sibisi, Sushmita Sumant, Christine Suver, Yanga Thungana, Meghasyam Tummalacherla, Jennifer Velloza, Pamela Y. Collins, Mina Fazel, Tamsin Ford, Melvyn Freeman, Soumitra Pathare, Zukiswa Zingela, The MindKind Consortium , Megan Doerr",published 19 Apr 2023,PLOS ONE,https://doi.org/10.1371/journal.pone.0279857,5
Prevalence of Dyslipidaemia and Associated Risk Factors in a Rural Population in South-Western Uganda: A Community Based Survey,"Gershim Asiki, Georgina A. V. Murphy, Kathy Baisley, Rebecca N. Nsubuga, Alex Karabarinde, Robert Newton, Janet Seeley, Elizabeth H. Young, Anatoli Kamali, Manjinder S. Sandhu",published 14 May 2015,PLOS ONE,https://doi.org/10.1371/journal.pone.0126166,47
"The relationship between women’s experience of intimate partner violence and other socio-demographic factors, and under-5 children’s health in South Africa","Sasha Frade, Nicole De Wet-Billings",published 25 Nov 2019,PLOS ONE,https://doi.org/10.1371/journal.pone.0225412,3
Who Should We Target? The Impact of Individual and Family Characteristics on the Expressed Need for Community-Based Treatment Support in HIV Patients in South Africa,"Edwin Wouters, Frederik le Roux Booysen, Caroline Masquillier",published 14 Oct 2016,PLOS ONE,https://doi.org/10.1371/journal.pone.0163963,3
"HIV incidence and predictors of inconsistent condom use among adult men enrolled into an HIV vaccine preparedness study, Rustenburg, South Africa","Pholo Maenetje, Christina Lindan, Heeran Makkan, Candice M. Chetty-Makkan, Mary H. Latka, Salome Charalambous, Mandla Mlotshwa, Matshidiso Malefo, William Brumskine, Nancy K. Hills, Matthew A. Price, Vinodh Edward",published 03 Apr 2019,PLOS ONE,https://doi.org/10.1371/journal.pone.0214786,5
"Population Distribution, Settlement Patterns and Accessibility across Africa in 2010","Catherine Linard, Marius Gilbert, Robert W. Snow, Abdisalan M. Noor, Andrew J. Tatem",published 21 Feb 2012,PLOS ONE,https://doi.org/10.1371/journal.pone.0031743,474
Molecular Paleoclimate Reconstructions over the Last 9 ka from a Peat Sequence in South China,"Xinxin Wang, Xianyu Huang, Dirk Sachse, Weihua Ding, Jiantao Xue",published 09 Aug 2016,PLOS ONE,https://doi.org/10.1371/journal.pone.0160934,17
"Prevalence of HIV-1 Drug Resistance among Women Screening for HIV Prevention Trials in KwaZulu-Natal, South Africa (MTN-009)","Urvi M. Parikh, Photini Kiepiela, Shayhana Ganesh, Kailazarid Gomez, Stephanie Horn, Krista Eskay, Cliff Kelly, Barbara Mensch, Pamina Gorbach, Lydia Soto-Torres, Gita Ramjee, John W. Mellors, on behalf of the IPTc Taskforce",published 09 Apr 2013,PLOS ONE,https://doi.org/10.1371/journal.pone.0059787,26
Predictors of Inconsistent Condom Use among a Hard to Reach Population of Young Women with Multiple Sexual Partners in Peri-Urban South Africa,"Yanga Z. Zembe, Loraine Townsend, Anna Thorson, Anna Mia Ekström",published 20 Dec 2012,PLOS ONE,https://doi.org/10.1371/journal.pone.0051998,29
"Quality of Voluntary Medical Male Circumcision Services during Scale-Up: A Comparative Process Evaluation in Kenya, South Africa, Tanzania and Zimbabwe","Larissa Jennings, Jane Bertrand, Dino Rech, Steven A. Harvey, Karin Hatzold, Christopher A. Samkange, Dickens S. Omondi Aduda, Bennett Fimbo, Peter Cherutich, Linnea Perry, Delivette Castor, Emmanuel Njeuhmeli",published 06 May 2014,PLOS ONE,https://doi.org/10.1371/journal.pone.0079524,27
Testing for saturation in qualitative evidence syntheses: An update of HIV adherence in Africa,"Anke Rohwer, Lynn Hendricks, Sandy Oliver, Paul Garner",published 19 Oct 2021,PLOS ONE,https://doi.org/10.1371/journal.pone.0258352,4
"Distribution and diversity of aquatic macroinvertebrate assemblages in a semi-arid region earmarked for shale gas exploration (Eastern Cape Karoo, South Africa)","Annah Mabidi, Matthew S. Bird, Renzo Perissinotto",published 02 Jun 2017,PLOS ONE,https://doi.org/10.1371/journal.pone.0178559,30
Autosomal and mtDNA Markers Affirm the Distinctiveness of Lions in West and Central Africa,"Laura D. Bertola, Laura Tensen, Pim van Hooft, Paula A. White, Carlos A. Driscoll, Philipp Henschel, Anthony Caragiulo, Isabela Dias-Freedman, Etotépé A. Sogbohossou, Pricelia N. Tumenta, Tuqa H. Jirmo, Geert R. de Snoo, Hans H. de Iongh, Klaas Vrieling",published 14 Oct 2015,PLOS ONE,https://doi.org/10.1371/journal.pone.0137975,30
Epidemiology of Histologically Proven Glomerulonephritis in Africa: A Systematic Review and Meta-Analysis,"Ikechi G. Okpechi, Oluwatoyin I. Ameh, Aminu K. Bello, Pierre Ronco, Charles R. Swanepoel, Andre P. Kengne",published 24 Mar 2016,PLOS ONE,https://doi.org/10.1371/journal.pone.0152203,56
Interventions that effectively target,"Emmanuel W. Kaindoa, Nancy S. Matowo, Halfan S. Ngowo, Gustav Mkandawile, Arnold Mmbando, Marcelina Finda, Fredros O. Okumu",published 18 May 2017,PLOS ONE,https://doi.org/10.1371/journal.pone.0177807,156
Intra-host and intra-household diversity of influenza A viruses during household transmissions in the 2013 season in 2 peri-urban communities of South Africa,"Ziyaad Valley-Omar, Preetha Iyengar, Claire von Mollendorf, Stefano Tempia, Alexandra Moerdyk, Orienka Hellferscee, Neil Martinson, Meredith McMorrow, Ebrahim Variava, Katlego Masonoke, Adam L. Cohen, Cheryl Cohen, Florette K. Treurnicht",published 24 May 2018,PLOS ONE,https://doi.org/10.1371/journal.pone.0198101,4
Burden of Diabetes and First Evidence for the Utility of HbA1c for Diagnosis and Detection of Diabetes in Urban Black South Africans: The Durban Diabetes Study,"Thomas R. Hird, Fraser J. Pirie, Tonya M. Esterhuizen, Brian O’Leary, Mark I. McCarthy, Elizabeth H. Young, Manjinder S. Sandhu, Ayesha A. Motala",published 25 Aug 2016,PLOS ONE,https://doi.org/10.1371/journal.pone.0161966,43
Household point of care CD4 testing and isoniazid preventive therapy initiation in a household TB contact tracing programme in two districts of South Africa,"Liesl Page-Shipp, James J. Lewis, Kavindhran Velen, Sedikanelo Senoge, Elizabeth Zishiri, Flora Popane, Violet N. Chihota, Dave Clark, Gavin J. Churchyard, Salome Charalambous",published 02 Mar 2018,PLOS ONE,https://doi.org/10.1371/journal.pone.0192089,7
Autopsy Prevalence of Tuberculosis and Other Potentially Treatable Infections among Adults with Advanced HIV Enrolled in Out-Patient Care in South Africa,"Aaron S. Karat, Tanvier Omar, Anne von Gottberg, Mpho Tlali, Violet N. Chihota, Gavin J. Churchyard, Katherine L. Fielding, Suzanne Johnson, Neil A. Martinson, Kerrigan McCarthy, Nicole Wolter, Emily B. Wong, Salome Charalambous, Alison D. Grant",published 09 Nov 2016,PLOS ONE,https://doi.org/10.1371/journal.pone.0166158,46
"The distribution of insect pests and the associated loss of stored sorghum in the Kena district of Konso Zone, South-Western Ethiopia","Ararso Gognsha Desta, Berhanu Hiruy Yeshitila",published 12 Jan 2024,PLOS ONE,https://doi.org/10.1371/journal.pone.0295833,0
Correlates of diabetic polyneuropathy of the elderly in Sub-Saharan Africa,"Nadine Simo, Callixte Kuate-Tegueu, Steve Ngankou-Tchankeu, Jacques Doumbe, Youssoufa Maiga, Matteo Cesari, Jean-François Dartigues, Andre-Pascal Kengne, Maturin Tabue-Teguo",published 29 Oct 2020,PLOS ONE,https://doi.org/10.1371/journal.pone.0240602,5
"Implementation of Adolescent-Friendly Voluntary Medical Male Circumcision Using a School Based Recruitment Program in Rural KwaZulu-Natal, South Africa","Carl Montague, Nelisiwe Ngcobo, Gethwana Mahlase, Janet Frohlich, Cheryl Pillay, Nonhlanhla Yende-Zuma, Hilton Humphries, Rachael Dellar, Kogieleum Naidoo, Quarraisha Abdool Karim",published 02 May 2014,PLOS ONE,https://doi.org/10.1371/journal.pone.0096468,38
Epidemiology of cardiovascular diseases related admissions in a referral hospital in the South West region of Cameroon: A cross-sectional study in sub-Saharan Africa,"Clovis Nkoke, Ahmadou Musa Jingi, Christelle Makoge, Denis Teuwafeu, Cyrille Nkouonlack, Anastase Dzudie",published 19 Dec 2019,PLOS ONE,https://doi.org/10.1371/journal.pone.0226644,8
Influence of Coastal Upwelling on SST Trends along the South Coast of Java,"R. Varela, F. Santos, M. Gómez-Gesteira, I. Álvarez, X. Costoya, J. M. Días",published 08 Sep 2016,PLOS ONE,https://doi.org/10.1371/journal.pone.0162122,23
Provider-Initiated HIV Testing and Counseling: Increased Uptake in Two Public Community Health Centers in South Africa and Implications for Scale-Up,"Shona Dalal, Chung-won Lee, Thato Farirai, Allison Schilsky, Thurma Goldman, Janet Moore, Naomi N. Bock",published 17 Nov 2011,PLOS ONE,https://doi.org/10.1371/journal.pone.0027293,50
"Is Younger Really Safer? A Qualitative Study of Perceived Risks and Benefits of Age-Disparate Relationships among Women in Cape Town, South Africa","Roxanne Beauclair, Wim Delva",published 15 Nov 2013,PLOS ONE,https://doi.org/10.1371/journal.pone.0081748,22
Implementing universal HIV treatment in a high HIV prevalence and rural South African setting – Field experiences and recommendations of health care providers,"Melanie Plazy, Delphine Perriat, Dumile Gumede, Sylvie Boyer, Deenan Pillay, François Dabis, Janet Seeley, Joanna Orne-Gliemann",published 20 Nov 2017,PLOS ONE,https://doi.org/10.1371/journal.pone.0186883,14
Sequential Immunization with gp140 Boosts Immune Responses Primed by Modified Vaccinia Ankara or DNA in HIV-Uninfected South African Participants,"Gavin Churchyard, Koleka Mlisana, Shelly Karuna, Anna-Lise Williamson, Carolyn Williamson, Lynn Morris, Georgia D. Tomaras, Stephen C. De Rosa, Peter B. Gilbert, Niya Gu, Chenchen Yu, Nonhlanhla N. Mkhize, Tandile Hermanus, Mary Allen, Michael Pensiero, Susan W. Barnett, Glenda Gray, Linda-Gail Bekker, David C. Montefiori, James Kublin, Lawrence Corey",published 01 Sep 2016,PLOS ONE,https://doi.org/10.1371/journal.pone.0161753,18
"Incidence, pathogens and antimicrobial resistance of blood and cerebrospinal fluid isolates from a tertiary neonatal unit in South Africa: A 10 year retrospective review","Reenu Thomas, Claude Ondongo-Ezhet, Nini Motsoaledi, Mike Sharland, Michelle Clements, Sithembiso Velaphi",published 19 Jan 2024,PLOS ONE,https://doi.org/10.1371/journal.pone.0297371,0
Preliminary model assessing the cost-effectiveness of preoperative chlorhexidine mouthwash at reducing postoperative pneumonia among abdominal surgery patients in South Africa,"Mwayi Kachapila, Adesoji O. Ademuyiwa, Bruce M. Biccard, Dhruva N. Ghosh, James Glasbey, Mark Monahan, Rachel Moore, Dion G. Morton, Raymond Oppong, Rupert Pearse, Tracy E. Roberts, NIHR Global Health Research Unit on Global Surgery , ASOS Investigators , STARSurg Collaborative",published 12 Aug 2021,PLOS ONE,https://doi.org/10.1371/journal.pone.0254698,5
Ward-specific clustering of methicillin-resistant,"Wilhelmina Strasheim, Olga Perovic, Ashika Singh-Moodley, Stanford Kwanda, Arshad Ismail, Michelle Lowe",published 29 Jun 2021,PLOS ONE,https://doi.org/10.1371/journal.pone.0253883,3
Genome-wide association analysis of Russian wheat aphid (,"Lavinia Kisten, Vicki L. Tolmay, Isack Mathew, Scott L. Sydenham, Eduard Venter",published 28 Dec 2020,PLOS ONE,https://doi.org/10.1371/journal.pone.0244455,8
Gaining traction: Promising shifts in gender norms and intimate partner violence in the context of a community-based HIV prevention trial in South Africa,"Ann Gottert, Julie Pulerwitz, Nicole Haberland, Rhandzekile Mathebula, Dumisani Rebombo, Kathryn Spielman, Rebecca West, Aimée Julien, Rhian Twine, Dean Peacock, Mi-Suk Kang Dufour, F. Xavier Gómez-Olivé, Audrey Pettifor, Sheri A. Lippman, Kathleen Kahn",published 20 Aug 2020,PLOS ONE,https://doi.org/10.1371/journal.pone.0237084,16
"A mixed methods investigation of implementation barriers and facilitators to a daily mobile phone sexual risk assessment for young women in Soweto, South Africa","Janan J. Dietrich, Stefanie Hornschuh, Mamakiri Khunwane, Lerato M. Makhale, Kennedy Otwombe, Cecilia Morgan, Yunda Huang, Maria Lemos, Erica Lazarus, James G. Kublin, Glenda E. Gray, Fatima Laher, Michele Andrasik, on behalf of the HVTN 915 team",published 23 Apr 2020,PLOS ONE,https://doi.org/10.1371/journal.pone.0231086,11
A ten-year review of ESBL and non-ESBL,"Oliver Ombeva Malande, James Nuttall, Vashini Pillay, Colleen Bamford, Brian Eley",published 24 Sep 2019,PLOS ONE,https://doi.org/10.1371/journal.pone.0222675,17
"The impact of the single exit price policy on a basket of generic medicines in South Africa, using a time series analysis from 1999 to 2014","Rajatheran Moodley, Fatima Suleman",published 31 Jul 2019,PLOS ONE,https://doi.org/10.1371/journal.pone.0219690,11
"Correction: Costs and cost-effectiveness of LEEP versus cryotherapy for treating cervical dysplasia among HIV-positive women in Johannesburg, South Africa","Naomi Lince-Deroche, Craig van Rensburg, Jacqueline Roseleur, Busola Sanusi, Jane Phiri, Pam Michelow, Jennifer S. Smith, Cindy Firnhaber",published 12 Feb 2019,PLOS ONE,https://doi.org/10.1371/journal.pone.0212391,0
"Prevalence, incidence and correlates of low risk HPV infection and anogenital warts in a cohort of women living with HIV in Burkina Faso and South Africa","Admire Chikandiwa, Helen Kelly, Bernard Sawadogo, Jean Ngou, Pedro T. Pisa, Lorna Gibson, Marie-Noelle Didelot, Nicolas Meda, Helen A. Weiss, Michel Segondy, Philippe Mayaud, Sinead Delany-Moretlwe, on behalf of the HARP Study Group",published 01 May 2018,PLOS ONE,https://doi.org/10.1371/journal.pone.0196018,15
Performance verification of the new fully automated Aquios flow cytometer PanLeucogate (PLG) platform for CD4-T-lymphocyte enumeration in South Africa,"Lindi-Marie Coetzee, Deborah K. Glencross",published 03 Nov 2017,PLOS ONE,https://doi.org/10.1371/journal.pone.0187456,19
Heat treatment as a universal technical solution for silcrete use? A comparison between silcrete from the Western Cape (South Africa) and the Kalahari (Botswana),"Patrick Schmidt, David J. Nash, Sheila Coulson, Matthias B. Göden, Graeme J. Awcock",published 19 Jul 2017,PLOS ONE,https://doi.org/10.1371/journal.pone.0181586,20
Diagnostic Accuracy of Lateral Flow Urine LAM Assay for TB Screening of Adults with Advanced Immunosuppression Attending Routine HIV Care in South Africa,"Yasmeen Hanifa, Katherine L. Fielding, Violet N. Chihota, Lungiswa Adonis, Salome Charalambous, Alan Karstaedt, Kerrigan McCarthy, Mark P. Nicol, Nontobeko T. Ndlovu, Faieza Sahid, Gavin J. Churchyard, Alison D. Grant",published 07 Jun 2016,PLOS ONE,https://doi.org/10.1371/journal.pone.0156866,16
Differing Methods and Definitions Influence DALY estimates: Using Population-Based Data to Calculate the Burden of Convulsive Epilepsy in Rural South Africa,"Ryan G. Wagner, Fredrick Ibinda, Stephen Tollman, Lars Lindholm, Charles R. Newton, Melanie Y. Bertram",published 23 Dec 2015,PLOS ONE,https://doi.org/10.1371/journal.pone.0145300,25
"A Cross Sectional Analysis of Gonococcal and Chlamydial Infections among Men-Who-Have-Sex-with-Men in Cape Town, South Africa","Kevin Rebe, David Lewis, Landon Myer, Glenn de Swardt, Helen Struthers, Monika Kamkuemah, James McIntyre",published 29 Sep 2015,PLOS ONE,https://doi.org/10.1371/journal.pone.0138315,52
Effects of Different Missing Data Imputation Techniques on the Performance of Undiagnosed Diabetes Risk Prediction Models in a Mixed-Ancestry Population of South Africa,"Katya L. Masconi, Tandi E. Matsha, Rajiv T. Erasmus, Andre P. Kengne",published 25 Sep 2015,PLOS ONE,https://doi.org/10.1371/journal.pone.0139210,19
"Correction: Correction: CD4 and Viral Load Dynamics in Antiretroviral-Naïve HIV-Infected Adults from Soweto, South Africa: A Prospective Cohort",The PLOS ONE Staff,published 13 Jul 2015,PLOS ONE,https://doi.org/10.1371/journal.pone.0133093,0
Biotransformation and Oxidative Stress Responses in Captive Nile Crocodile (,"Augustine Arukwe, Randi Røsbak, Aina O. Adeogun, Håkon A. Langberg, Annette Venter, Jan Myburgh, Christo Botha, Maura Benedetti, Francesco Regoli",published 18 Jun 2015,PLOS ONE,https://doi.org/10.1371/journal.pone.0130002,31
"Elective Delivery at Term after a Previous Unexplained Intra-Uterine Fetal Death: Audit of Delivery Outcome at Tygerberg Hospital, South Africa","Stefan Gebhardt, Leana Oberholzer",published 15 Jun 2015,PLOS ONE,https://doi.org/10.1371/journal.pone.0130254,6
Nosocomial Outbreak of New Delhi Metallo-β-Lactamase-1-Producing Gram-Negative Bacteria in South Africa: A Case-Control Study,"Pieter de Jager, Tobias Chirwa, Shan Naidoo, Olga Perovic, Juno Thomas",published 24 Apr 2015,PLOS ONE,https://doi.org/10.1371/journal.pone.0123337,39
Morbidity and Mortality According to Latest CD4+ Cell Count among HIV Positive Individuals in South Africa Who Enrolled in Project Phidisa,"Patrick H. Maduna, Matt Dolan, Lwando Kondlo, Honey Mabuza, Judith N. Dlamini, Mike Polis, Thabo Mnisi, Susan Orsega, Patrick Maja, Lotty Ledwaba, Thuthukile Molefe, Phumelele Sangweni, Lisette Malan, Gugu Matchaba, Paul Khabo, Greg Grandits, James D. Neaton",published 09 Apr 2015,PLOS ONE,https://doi.org/10.1371/journal.pone.0121843,13
High Prevalence of the K65R Mutation in HIV-1 Subtype C Infected Patients Failing Tenofovir-Based First-Line Regimens in South Africa,"Lindiwe Skhosana, Kim Steegen, Michelle Bronze, Azwidowi Lukhwareni, Esrom Letsoalo, Maria A. Papathanasopoulos, Sergio C. Carmona, Wendy S. Stevens",published 06 Feb 2015,PLOS ONE,https://doi.org/10.1371/journal.pone.0118145,37
Estimating the Cost-Effectiveness of Pre-Exposure Prophylaxis to Reduce HIV-1 and HSV-2 Incidence in HIV-Serodiscordant Couples in South Africa,"Britta L. Jewell, Ide Cremin, Michael Pickles, Connie Celum, Jared M. Baeten, Sinead Delany-Moretlwe, Timothy B. Hallett",published 23 Jan 2015,PLOS ONE,https://doi.org/10.1371/journal.pone.0115511,18
How Much Demand for New HIV Prevention Technologies Can We Really Expect? Results from a Discrete Choice Experiment in South Africa,"Fern Terris-Prestholt, Kara Hanson, Catherine MacPhail, Peter Vickerman, Helen Rees, Charlotte Watts",published 30 Dec 2013,PLOS ONE,https://doi.org/10.1371/journal.pone.0083193,56
"HIV-Infected Adolescent Mothers and Their Infants: Low Coverage of HIV Services and High Risk of HIV Transmission in KwaZulu-Natal, South Africa","Christiane Horwood, Lisa M. Butler, Lyn Haskins, Sifiso Phakathi, Nigel Rollins",published 20 Sep 2013,PLOS ONE,https://doi.org/10.1371/journal.pone.0074568,54
"The Impact of Choice of NNRTI on Short-Term Treatment Outcomes among HIV-Infected Patients Prescribed Tenofovir and Lamivudine in Johannesburg, South Africa","Kate Shearer, Matthew P. Fox, Mhairi Maskew, Rebecca Berhanu, Lawrence Long, Ian Sanne",published 07 Aug 2013,PLOS ONE,https://doi.org/10.1371/journal.pone.0071719,8
