title,authors,publish_date,journal_name,doi,citations
Screening for developmental disabilities in HIV positive and HIV negative children in South Africa: Results from the Asenze Study,"Justin Knox, Stephen M. Arpadi, Shuaib Kauchali, Murray Craib, Jane D. Kvalsvig, Myra Taylor, Fatimatou Bah, Claude Mellins, Leslie L. Davidson",published 03 Jul 2018,PLOS ONE,https://doi.org/10.1371/journal.pone.0199860,13
Using mHealth to improve tuberculosis case identification and treatment initiation in South Africa: Results from a pilot study,"Noriah Maraba, Christopher J. Hoffmann, Violet N. Chihota, Larry W. Chang, Nazir Ismail, Sue Candy, Edwin Madibogo, Marc Katzwinkel, Gavin J. Churchyard, Kerrigan McCarthy",published 03 Jul 2018,PLOS ONE,https://doi.org/10.1371/journal.pone.0199687,26
Strengthening primary eye care in South Africa: An assessment of services and prospective evaluation of a health systems support package,"Rivka R. Lilian, Jean Railton, Erik Schaftenaar, Moyahabo Mabitsi, Cornelis J. Grobbelaar, N. Sellina Khosa, Babra H. Maluleke, Helen E. Struthers, James A. McIntyre, Remco P. H. Peters",published 14 May 2018,PLOS ONE,https://doi.org/10.1371/journal.pone.0197432,16
"Discovery of genetic variants of the kinases that activate tenofovir among individuals in the United States, Thailand, and South Africa: HPTN067","Dominique B. Figueroa, Joseph Tillotson, Maoji Li, Estelle Piwowar-Manning, Craig W. Hendrix, Timothy H. Holtz, Kevin Bokoch, Linda-Gail Bekker, Frits van Griensven, Sharon Mannheimer, James P. Hughes, Robert M. Grant, Namandjé N. Bumpus",published 11 Apr 2018,PLOS ONE,https://doi.org/10.1371/journal.pone.0195764,12
Determinants of late antenatal care presentation in rural and peri-urban communities in South Africa: A cross-sectional study,"Joy Ebonwu, Alexandra Mumbauer, Margot Uys, Milton L. Wainberg, Andrew Medina-Marino",published 08 Mar 2018,PLOS ONE,https://doi.org/10.1371/journal.pone.0191903,80
The role of agency in the implementation of Isoniazid Preventive Therapy (IPT): Lessons from,"Jody Boffa, Maria Mayan, Sithembile Ndlovu, Tsholofelo Mhlaba, Tyler Williamson, Reginald Sauve, Dina Fisher",published 07 Mar 2018,PLOS ONE,https://doi.org/10.1371/journal.pone.0193571,7
The cost and utilisation patterns of a pilot sign language interpreter service for primary health care services in South Africa,"Tryphine Zulu, Marion Heap, Edina Sinanovic",published 22 Dec 2017,PLOS ONE,https://doi.org/10.1371/journal.pone.0189983,6
"Field evaluation of HIV point-of-care testing for early infant diagnosis in Cape Town, South Africa","Lorna Dunning, Max Kroon, Nei-yuan Hsiao, Landon Myer",published 20 Dec 2017,PLOS ONE,https://doi.org/10.1371/journal.pone.0189226,32
"Mixed methods inquiry into traditional healers’ treatment of mental, neurological and substance abuse disorders in rural South Africa","Carolyn M. Audet, Sizzy Ngobeni, Erin Graves, Ryan G. Wagner",published 19 Dec 2017,PLOS ONE,https://doi.org/10.1371/journal.pone.0188433,33
"Breast conservation surgery versus total mastectomy among women with localized breast cancer in Soweto, South Africa","Herbert Cubasch, Maureen Joffe, Paul Ruff, Donald Dietz, Evan Rosenbaum, Nivashni Murugan, Ming Tsai Chih, Oluwatosin Ayeni, Caroline Dickens, Katherine Crew, Judith S. Jacobson, Alfred Neugut",published 10 Aug 2017,PLOS ONE,https://doi.org/10.1371/journal.pone.0182125,14
"Lithic technological responses to Late Pleistocene glacial cycling at Pinnacle Point Site 5-6, South Africa","Jayne Wilkins, Kyle S. Brown, Simen Oestmo, Telmo Pereira, Kathryn L. Ranhorn, Benjamin J. Schoville, Curtis W. Marean",published 29 Mar 2017,PLOS ONE,https://doi.org/10.1371/journal.pone.0174051,56
Correction: Estimating Client Out-of-Pocket Costs for Accessing Voluntary Medical Male Circumcision in South Africa,"Michel Tchuenche, Vibhuti Haté, Dacia McPherson, Eurica Palmer, Ananthy Thambinayagam, Dayanund Loykissoonlal, Emmanuel Njeuhmeli, Steven Forsythe",published 03 Jan 2017,PLOS ONE,https://doi.org/10.1371/journal.pone.0169715,0
"Adherence to Concurrent Tuberculosis Treatment and Antiretroviral Treatment among Co-Infected Persons in South Africa, 2008–2010","Ernesha Webb Mazinyo, Lindsay Kim, Sikhethiwe Masuku, Joey L. Lancaster, Ronel Odendaal, Margot Uys, Laura Jean Podewils, Martie L. Van der Walt",published 21 Jul 2016,PLOS ONE,https://doi.org/10.1371/journal.pone.0159317,14
Cost and Impact of Voluntary Medical Male Circumcision in South Africa: Focusing the Program on Specific Age Groups and Provinces,"Katharine Kripke, Ping-An Chen, Andrea Vazzano, Ananthy Thambinayagam, Yogan Pillay, Dayanund Loykissoonlal, Collen Bonnecwe, Peter Barron, Eva Kiwango, Delivette Castor, Emmanuel Njeuhmeli",published 13 Jul 2016,PLOS ONE,https://doi.org/10.1371/journal.pone.0157071,32
"Mental Health Inequalities in Adolescents Growing Up in Post-Apartheid South Africa: Cross-Sectional Survey, SHaW Study","Jayati Das-Munshi, Crick Lund, Catherine Mathews, Charlotte Clark, Catherine Rothon, Stephen Stansfeld",published 03 May 2016,PLOS ONE,https://doi.org/10.1371/journal.pone.0154478,81
"Individual and Population Level Impact of Key HIV Risk Factors on HIV Incidence Rates in Durban, South Africa","Gita Ramjee, Suri Moonsamy, Nathlee Samantha Abbai, Handan Wand",published 22 Apr 2016,PLOS ONE,https://doi.org/10.1371/journal.pone.0153969,19
: Oral HIV Self-Testing in an Informal Settlement in South Africa,"Guillermo Martínez Pérez, Vivian Cox, Tom Ellman, Ann Moore, Gabriela Patten, Amir Shroufi, Kathryn Stinson, Gilles Van Cutsem, Maryrene Ibeto",published 04 Apr 2016,PLOS ONE,https://doi.org/10.1371/journal.pone.0152653,61
"Serotypes and Mortality in Adults and Adolescents in South Africa: Analysis of National Surveillance Data, 2003 - 2008","Cheryl Cohen, Nireshni Naidoo, Susan Meiring, Linda de Gouveia, Claire von Mollendorf, Sibongile Walaza, Preneshni Naicker, Shabir A. Madhi, Charles Feldman, Keith P. Klugman, Halima Dawood, Anne von Gottberg, GERMS-SA",published 13 Oct 2015,PLOS ONE,https://doi.org/10.1371/journal.pone.0140185,18
High Prevalence of,"Abraham J. Niehaus, Koleka Mlisana, Neel R. Gandhi, Barun Mathema, James C. M. Brust",published 02 Sep 2015,PLOS ONE,https://doi.org/10.1371/journal.pone.0135003,31
Albuminuria Is Associated with Traditional Cardiovascular Risk Factors and Viral Load in HIV-Infected Patients in Rural South Africa,"G. Emerens Wensink, Annelot F. Schoffelen, Hugo A. Tempelman, Maarten B. Rookmaaker, Andy I. M. Hoepelman, Roos E. Barth",published 26 Aug 2015,PLOS ONE,https://doi.org/10.1371/journal.pone.0136529,16
"Examining the Causes and Consequences of Short-Term Behavioral Change during the Middle Stone Age at Sibudu, South Africa","Nicholas J. Conard, Manuel Will",published 22 Jun 2015,PLOS ONE,https://doi.org/10.1371/journal.pone.0130001,41
"Correction: The Impact of Gender Norms on Condom Use among HIV-Positive Adults in KwaZulu-Natal, South Africa","Kristin Fladseth, Mitzy Gafos, Marie Louise Newell, Nuala McGrath",published 04 Jun 2015,PLOS ONE,https://doi.org/10.1371/journal.pone.0129637,4
"To Kill, Stay or Flee: The Effects of Lions and Landscape Factors on Habitat and Kill Site Selection of Cheetahs in South Africa","Susana Rostro-García, Jan F. Kamler, Luke T. B. Hunter",published 18 Feb 2015,PLOS ONE,https://doi.org/10.1371/journal.pone.0117743,51
"Detection of Transmission Clusters of HIV-1 Subtype C over a 21-Year Period in Cape Town, South Africa","Eduan Wilkinson, Susan Engelbrecht, Tulio de Oliveira",published 30 Oct 2014,PLOS ONE,https://doi.org/10.1371/journal.pone.0109296,9
Population Snapshot of,"Kedibone M. Ndlangisa, Mignon du Plessis, Nicole Wolter, Linda de Gouveia, Keith P. Klugman, Anne von Gottberg, for GERMS-SA",published 18 Sep 2014,PLOS ONE,https://doi.org/10.1371/journal.pone.0107666,17
High Seroprevalence of Human Herpesviruses in HIV-Infected Individuals Attending Primary Healthcare Facilities in Rural South Africa,"Erik Schaftenaar, Georges M. G. M. Verjans, Sarah Getu, James A. McIntyre, Helen E. Struthers, Albert D. M. E. Osterhaus, Remco P. H. Peters",published 10 Jun 2014,PLOS ONE,https://doi.org/10.1371/journal.pone.0099243,35
"Development, Calibration and Performance of an HIV Transmission Model Incorporating Natural History and Behavioral Patterns: Application in South Africa","Alethea W. McCormick, Nadia N. Abuelezam, Erin R. Rhode, Taige Hou, Rochelle P. Walensky, Pamela P. Pei, Jessica E. Becker, Madeline A. DiLorenzo, Elena Losina, Kenneth A. Freedberg, Marc Lipsitch, George R. Seage III",published 27 May 2014,PLOS ONE,https://doi.org/10.1371/journal.pone.0098272,22
"Provider Attitudes toward the Voluntary Medical Male Circumcision Scale-Up in Kenya, South Africa, Tanzania and Zimbabwe","Webster Mavhu, Sasha Frade, Ann-Marie Yongho, Margaret Farrell, Karin Hatzold, Michael Machaku, Mathews Onyango, Owen Mugurungi, Bennett Fimbo, Peter Cherutich, Dino Rech, Delivette Castor, Emmanuel Njeuhmeli, Jane T. Bertrand",published 06 May 2014,PLOS ONE,https://doi.org/10.1371/journal.pone.0082911,9
Implications of the Fast-Evolving Scale-Up of Adult Voluntary Medical Male Circumcision for Quality of Services in South Africa,"Dino Rech, Alexandra Spyrelis, Sasha Frade, Linnea Perry, Margaret Farrell, Rebecca Fertziger, Carlos Toledo, Delivette Castor, Emmanuel Njeuhmeli, Dayanund Loykissoonlal, Jane T. Bertrand",published 06 May 2014,PLOS ONE,https://doi.org/10.1371/journal.pone.0080577,25
"Gender Perspective of Risk Factors Associated with Disclosure of HIV Status, a Cross-Sectional Study in Soweto, South Africa","Elisa Longinetti, Michele Santacatterina, Ziad El-Khatib",published 17 Apr 2014,PLOS ONE,https://doi.org/10.1371/journal.pone.0095440,29
"Women’s Experiences with Oral and Vaginal Pre-Exposure Prophylaxis: The VOICE-C Qualitative Study in Johannesburg, South Africa","Ariane van der Straten, Jonathan Stadler, Elizabeth Montgomery, Miriam Hartmann, Busiswe Magazi, Florence Mathebula, Katie Schwartz, Nicole Laborde, Lydia Soto-Torres",published 21 Feb 2014,PLOS ONE,https://doi.org/10.1371/journal.pone.0089118,233
Potential Cost-Effectiveness of a New Infant Tuberculosis Vaccine in South Africa - Implications for Clinical Trials: A Decision Analysis,"Jared B. Ditkowsky, Kevin Schwartzman",published 15 Jan 2014,PLOS ONE,https://doi.org/10.1371/journal.pone.0083526,9
"Linkage to HIV, TB and Non-Communicable Disease Care from a Mobile Testing Unit in Cape Town, South Africa","Darshini Govindasamy, Katharina Kranzer, Nienke van Schaik, Farzad Noubary, Robin Wood, Rochelle P. Walensky, Kenneth A. Freedberg, Ingrid V. Bassett, Linda-Gail Bekker",published 13 Nov 2013,PLOS ONE,https://doi.org/10.1371/journal.pone.0080017,63
"Chronic Non-Communicable Disease and Healthcare Access in Middle-Aged and Older Women Living in Soweto, South Africa","Daniel Lopes Ibanez-Gonzalez, Shane A. Norris",published 29 Oct 2013,PLOS ONE,https://doi.org/10.1371/journal.pone.0078800,15
Determining Ancestry Proportions in Complex Admixture Scenarios in South Africa Using a Novel Proxy Ancestry Selection Method,"Emile R. Chimusa, Michelle Daya, Marlo Möller, Raj Ramesar, Brenna M. Henn, Paul D. van Helden, Nicola J. Mulder, Eileen G. Hoal",published 16 Sep 2013,PLOS ONE,https://doi.org/10.1371/journal.pone.0073971,36
Equity in Maternal Health in South Africa: Analysis of Health Service Access and Health Status in a National Household Survey,"Njeri Wabiri, Matthew Chersich, Khangelani Zuma, Duane Blaauw, Jane Goudge, Ntabozuko Dwane",published 06 Sep 2013,PLOS ONE,https://doi.org/10.1371/journal.pone.0073864,22
Gauging the Threat: The First Population Estimate for White Sharks in South Africa Using Photo Identification and Automated Software,"Alison V. Towner, Michelle A. Wcisel, Ryan R. Reisinger, David Edwards, Oliver J. D. Jewell",published 12 Jun 2013,PLOS ONE,https://doi.org/10.1371/journal.pone.0066035,59
Prevalent and Incident Tuberculosis Are Independent Risk Factors for Mortality among Patients Accessing Antiretroviral Therapy in South Africa,"Ankur Gupta, Robin Wood, Richard Kaplan, Linda-Gail Bekker, Stephen D. Lawn",published 13 Feb 2013,PLOS ONE,https://doi.org/10.1371/journal.pone.0055824,53
"Linkage of HIV-Infected Infants from Diagnosis to Antiretroviral Therapy Services across the Western Cape, South Africa","Nei-Yuan Hsiao, Kathryn Stinson, Landon Myer",published 06 Feb 2013,PLOS ONE,https://doi.org/10.1371/journal.pone.0055308,55
The Impact of Expanded Testing for Multidrug Resistant Tuberculosis Using Geontype MTBDR,"Colleen F. Hanrahan, Susan E. Dorman, Linda Erasmus, Hendrik Koornhof, Gerrit Coetzee, Jonathan E. Golub",published 30 Nov 2012,PLOS ONE,https://doi.org/10.1371/journal.pone.0049898,29
"Incidence, Clinical Spectrum, Risk Factors and Impact of HIV-Associated Immune Reconstitution Inflammatory Syndrome in South Africa","Lewis John Haddow, Mahomed-Yunus Suleman Moosa, Anisa Mosam, Pravi Moodley, Raveen Parboosing, Philippa Jane Easterbrook",published 12 Nov 2012,PLOS ONE,https://doi.org/10.1371/journal.pone.0040623,72
"Learning That Circumcision Is Protective against HIV: Risk Compensation among Men and Women in Cape Town, South Africa","Brendan Maughan-Brown, Atheendar S. Venkataramani",published 19 Jul 2012,PLOS ONE,https://doi.org/10.1371/journal.pone.0040753,25
Second-Line Antiretroviral Therapy in a Workplace and Community-Based Treatment Programme in South Africa: Determinants of Virological Outcome,"Victoria Johnston, Katherine Fielding, Salome Charalambous, Mildred Mampho, Gavin Churchyard, Andrew Phillips, Alison D. Grant",published 29 May 2012,PLOS ONE,https://doi.org/10.1371/journal.pone.0036997,30
Development of the Respiratory Index of Severity in Children (RISC) Score among Young Children with Respiratory Infections in South Africa,"Carrie Reed, Shabir A. Madhi, Keith P. Klugman, Locadiah Kuwanda, Justin R. Ortiz, Lyn Finelli, Alicia M. Fry",published 04 Jan 2012,PLOS ONE,https://doi.org/10.1371/journal.pone.0027793,128
Forensic Medicine in South Africa: Associations between Medical Practice and Legal Case Progression and Outcomes in Female Murders,"Naeemah Abrahams, Rachel Jewkes, Lorna J. Martin, Shanaaz Mathews",published 14 Dec 2011,PLOS ONE,https://doi.org/10.1371/journal.pone.0028620,17
The Tuberculin Skin Test versus QuantiFERON TB Gold® in Predicting Tuberculosis Disease in an Adolescent Cohort Study in South Africa,"Hassan Mahomed, Tony Hawkridge, Suzanne Verver, Deborah Abrahams, Lawrence Geiter, Mark Hatherill, Rodney Ehrlich, Willem A. Hanekom, Gregory D. Hussey",published 29 Mar 2011,PLOS ONE,https://doi.org/10.1371/journal.pone.0017984,111
"Potential Effects of Nutrient Profiles on Nutrient Intakes in the Netherlands, Greece, Spain, USA, Israel, China and South-Africa","Annet J. C. Roodenburg, Anke Schlatmann, Mariska Dötsch-Klerk, Robert Daamen, Jie Dong, Marta Guarro, Margarita Stergiou, Nazeeia Sayed, Eunice Ronoh, Léon Jansen, Jacob C. Seidell",published 23 Feb 2011,PLOS ONE,https://doi.org/10.1371/journal.pone.0014721,36
"Culture Conversion Among HIV Co-Infected Multidrug-Resistant Tuberculosis Patients in Tugela Ferry, South Africa","James C. M. Brust, Melissa Lygizos, Krisda Chaiyachati, Michelle Scott, Theo L. van der Merwe, Anthony P. Moll, Xuan Li, Marian Loveday, Sheila A. Bamber, Umesh G. Lalloo, Gerald H. Friedland, N. Sarita Shah, Neel R. Gandhi",published 06 Jan 2011,PLOS ONE,https://doi.org/10.1371/journal.pone.0015841,50
Evaluating the Cost-Effectiveness of Pre-Exposure Prophylaxis (PrEP) and Its Impact on HIV-1 Transmission in South Africa,"Carel Pretorius, John Stover, Lori Bollinger, Nicolas Bacaër, Brian Williams",published 05 Nov 2010,PLOS ONE,https://doi.org/10.1371/journal.pone.0013646,106
Annual Risk of Tuberculous Infection Using Different Methods in Communities with a High Prevalence of TB and HIV in Zambia and South Africa,"Kwame Shanaube, Charalambos Sismanidis, Helen Ayles, Nulda Beyers, Ab Schaap, Katherine-Anne Lawrence, Annie Barker, Peter Godfrey-Faussett",published 13 Nov 2009,PLOS ONE,https://doi.org/10.1371/journal.pone.0007749,58
Indoor Social Networks in a South African Township: Potential Contribution of Location to Tuberculosis Transmission,"Robin Wood, Kimberly Racow, Linda-Gail Bekker, Carl Morrow, Keren Middelkoop, Daniella Mark, Stephen D. Lawn",published 29 Jun 2012,PLOS ONE,https://doi.org/10.1371/journal.pone.0039246,51
Cryptic Speciation and Chromosomal Repatterning in the South African Climbing Mice,"Emanuela Solano, Peter J. Taylor, Anita Rautenbach, Anne Ropiquet, Riccardo Castiglia",published 13 Feb 2014,PLOS ONE,https://doi.org/10.1371/journal.pone.0088799,8
Population Structure of Humpback Whales from Their Breeding Grounds in the South Atlantic and Indian Oceans,"Howard C. Rosenbaum, Cristina Pomilla, Martin Mendez, Matthew S. Leslie, Peter B. Best, Ken P. Findlay, Gianna Minton, Peter J. Ersts, Timothy Collins, Marcia H. Engel, Sandro L. Bonatto, Deon P. G. H. Kotze, Mike Meÿer, Jaco Barendse, Meredith Thornton, Yvette Razafindrakoto, Solange Ngouessono, Michel Vely, Jeremy Kiszka",published 08 Oct 2009,PLOS ONE,https://doi.org/10.1371/journal.pone.0007318,84
Exploring the unintended consequences of learning a new language at a South African university,Mike Murray,published 20 Mar 2019,PLOS ONE,https://doi.org/10.1371/journal.pone.0213973,0
"Endophytic Bacteria in Toxic South African Plants: Identification, Phylogeny and Possible Involvement in Gousiekte","Brecht Verstraete, Daan Van Elst, Hester Steyn, Braam Van Wyk, Benny Lemaire, Erik Smets, Steven Dessein",published 26 Apr 2011,PLOS ONE,https://doi.org/10.1371/journal.pone.0019265,33
"The Epidemiology of Meningitis among Adults in a South African Province with a High HIV Prevalence, 2009-2012","Erika Britz, Olga Perovic, Claire von Mollendorf, Anne von Gottberg, Samantha Iyaloo, Vanessa Quan, Verushka Chetty, Charlotte Sriruttan, Nazir A. Ismail, Ananta Nanoo, Alfred Musekiwa, Carl Reddy, Karien Viljoen, Cheryl Cohen, Nelesh P. Govender",published 26 Sep 2016,PLOS ONE,https://doi.org/10.1371/journal.pone.0163036,37
Predictors of male circumcision incidence in a traditionally non-circumcising South African population-based cohort,"Katrina F. Ortblad, Till Bärnighausen, Natsayi Chimbindi, Samuel H. Masters, Joshua A. Salomon, Guy Harling",published 19 Dec 2018,PLOS ONE,https://doi.org/10.1371/journal.pone.0209172,8
A systematic review of elephant impact across Africa,"Robert A. R. Guldemond, Andrew Purdon, Rudi J. van Aarde",published 07 Jun 2017,PLOS ONE,https://doi.org/10.1371/journal.pone.0178935,42
"Nutritional status of school children in the South Tongu District, Ghana","Richard Gyan Aboagye, Nuworza Kugbey, Bright Opoku Ahinkorah, Abdul-Aziz Seidu, Abdul Cadri, Samuel Adolf Bosoka, Paa Yeboah Akonor, Mohammed Takase",published 24 Aug 2022,PLOS ONE,https://doi.org/10.1371/journal.pone.0269718,5
Shifts in Climate Foster Exceptional Opportunities for Species Radiation: The Case of South African Geraniums,"Hugo I. Martínez-Cabrera, Pedro R. Peres-Neto",published 17 Dec 2013,PLOS ONE,https://doi.org/10.1371/journal.pone.0083087,10
Does an Isoniazid Prophylaxis Register Improve Tuberculosis Contact Management in South African Children?,"Nelda van Soelen, Karen du Preez, Susan S. van Wyk, Anna M. Mandalakas, Don A. Enarson, Anthony J. Reid, Anneke C. Hesseling",published 10 Dec 2013,PLOS ONE,https://doi.org/10.1371/journal.pone.0080803,16
The association of parents’ behaviors related to salt with 24 h urinary sodium excretion of their children: A Spanish cross-sectional study,"Esther Cuadrado-Soto, África Peral-Suarez, Elena Rodríguez-Rodríguez, Aránzazu Aparicio, Pedro Andrés, Rosa M. Ortega, Ana M. López-Sobaler",published 27 Dec 2019,PLOS ONE,https://doi.org/10.1371/journal.pone.0227035,4
"Zimbabwe Culture before Mapungubwe: New Evidence from Mapela Hill, South-Western Zimbabwe","Shadreck Chirikure, Munyaradzi Manyanga, A. Mark Pollard, Foreman Bandama, Godfrey Mahachi, Innocent Pikirayi",published 31 Oct 2014,PLOS ONE,https://doi.org/10.1371/journal.pone.0111224,47
Factors Influencing Retention in Care after Starting Antiretroviral Therapy in a Rural South African Programme,"Tom H. Boyles, Lynne S. Wilkinson, Rory Leisegang, Gary Maartens",published 03 May 2011,PLOS ONE,https://doi.org/10.1371/journal.pone.0019201,73
Assessing the feasibility of a life history calendar to measure HIV risk and health in older South Africans,"Enid Schatz, Lucia Knight, Robert F. Belli, Sanyu A. Mojola",published 15 Jan 2020,PLOS ONE,https://doi.org/10.1371/journal.pone.0226024,6
"The Impact of HIV, an Antiretroviral Programme and Tuberculosis on Mortality in South African Platinum Miners, 1992–2010","Megan S. C. Lim, Robert J. Dowdeswell, Jill Murray, Nigel Field, Judith R. Glynn, Pam Sonnenberg",published 22 Jun 2012,PLOS ONE,https://doi.org/10.1371/journal.pone.0038598,20
Non-disclosure of tuberculosis diagnosis by patients to their household members in south western Uganda,"Miria Nyangoma, Francis Bajunirwe, Daniel Atwine",published 24 Jan 2020,PLOS ONE,https://doi.org/10.1371/journal.pone.0216689,8
A Regional Stable Carbon Isotope Dendro-Climatology from the South African Summer Rainfall Area,"Stephan Woodborne, Patience Gandiwa, Grant Hall, Adrian Patrut, Jemma Finch",published 18 Jul 2016,PLOS ONE,https://doi.org/10.1371/journal.pone.0159361,21
Community context and individual factors associated with arrests among young men in a South African township,"Joan Christodoulou, Lynissa R. Stokes, Jason Bantjes, Mark Tomlinson, Jackie Stewart, Stephan Rabie, Sarah Gordon, Andile Mayekiso, Mary Jane Rotheram-Borus",published 17 Jan 2019,PLOS ONE,https://doi.org/10.1371/journal.pone.0209073,4
"Prevalence of brucellosis among patients attending Wau Hospital, South Sudan","Nuol Aywel Madut, George William Nasinyama, John Bwalya Muma, Kenneth L. L. Sube, Moses Ocan, Adrian Muwonge, Jacques Godfroid, Ambrose Samuel Jubara, Clovice Kankya",published 27 Jun 2018,PLOS ONE,https://doi.org/10.1371/journal.pone.0199315,10
"Vitamin D Receptor Gene Expression and Function in a South African Population: Ethnicity, Vitamin D and","Vanessa O′Neill, Furaha Florence Asani, Tamsyn Jacki Jeffery, Donovan Sean Saccone, Liza Bornman",published 21 Jun 2013,PLOS ONE,https://doi.org/10.1371/journal.pone.0067663,68
Cardiovascular Risk Factor Burden in Africa and the Middle East: The Africa Middle East Cardiovascular Epidemiological (ACE) Study,"Alawi A. Alsheikh-Ali, Mohamed I. Omar, Frederick J. Raal, Wafa Rashed, Omar Hamoui, Abdoul Kane, Mohamed Alami, Paula Abreu, Walid M. Mashhoud",published 04 Aug 2014,PLOS ONE,https://doi.org/10.1371/journal.pone.0102830,99
Burden of New and Recurrent Tuberculosis in a Major South African City Stratified by Age and HIV-Status,"Robin Wood, Stephen D. Lawn, Judy Caldwell, Richard Kaplan, Keren Middelkoop, Linda-Gail Bekker",published 10 Oct 2011,PLOS ONE,https://doi.org/10.1371/journal.pone.0025098,89
The South African Rea Phela Health Study: A randomized controlled trial of communication retention strategies,"James M. Rhyne, Alexandra Mumbauer, Paul Rheeder, Megan N. Hall, Jeanine Genkinger, Andrew Medina-Marino",published 24 May 2018,PLOS ONE,https://doi.org/10.1371/journal.pone.0196900,1
Exploring perceptions of low risk behaviour and drivers to test for HIV among South African youth,"Tshifhiwa Muravha, Christopher J. Hoffmann, Claire Botha, Wellington Maruma, Salome Charalambous, Candice M. Chetty-Makkan",published 22 Jan 2021,PLOS ONE,https://doi.org/10.1371/journal.pone.0245542,9
Continuity of care for TB patients at a South African hospital: A qualitative participatory study of the experiences of hospital staff,"Frederick Marais, Idriss Ibrahim Kallon, Lilian Diana Dudley",published 18 Sep 2019,PLOS ONE,https://doi.org/10.1371/journal.pone.0222421,17
Health system barriers to implementation of TB preventive strategies in South African primary care facilities,"Eva Van Ginderdeuren, Jean Bassett, Colleen Hanrahan, Lillian Mutunga, Annelies Van Rie",published 14 Feb 2019,PLOS ONE,https://doi.org/10.1371/journal.pone.0212035,22
Anti-Retroviral Therapy Increases the Prevalence of Dyslipidemia in South African HIV-Infected Patients,"Joel A. Dave, Naomi S. Levitt, Ian L. Ross, Miguel Lacerda, Gary Maartens, Dirk Blom",published 17 Mar 2016,PLOS ONE,https://doi.org/10.1371/journal.pone.0151911,42
Psychometric Properties of the Child PTSD Checklist in a Community Sample of South African Children and Adolescents,"Mark E. Boyes, Lucie D. Cluver, Frances Gardner",published 03 Oct 2012,PLOS ONE,https://doi.org/10.1371/journal.pone.0046905,45
Cardiovascular Risk Factors in Patients with Addison's Disease: A Comparative Study of South African and Swedish Patients,"Ian Louis Ross, Ragnhildur Bergthorsdottir, Naomi Levitt, Joel Alex Dave, Desmond Schatz, David Marais, Gudmundur Johannsson",published 06 Mar 2014,PLOS ONE,https://doi.org/10.1371/journal.pone.0090768,21
"Individual and Household Level Risk Factors Associated with Malaria in Nchelenge District, a Region with Perennial Transmission: A Serial Cross-Sectional Study from 2012 to 2015","Jessie Pinchoff, Mike Chaponda, Timothy M. Shields, James Sichivula, Mbanga Muleba, Modest Mulenga, Tamaki Kobayashi, Frank C. Curriero, William J. Moss, for the Southern Africa International Centers of Excellence for Malaria Research",published 09 Jun 2016,PLOS ONE,https://doi.org/10.1371/journal.pone.0156717,44
High-risk human papillomavirus prevalence among South African women diagnosed with other STIs and BV,"Wenkosi Qulu, Andile Mtshali, Farzana Osman, Nonsikelelo Ndlela, Lungelo Ntuli, Gugulethu Mzobe, Nivashnee Naicker, Nigel Garrett, Anne Rompalo, Adrian Mindel, Sinaye Ngcapu, Lenine Liebenberg",published 30 Nov 2023,PLOS ONE,https://doi.org/10.1371/journal.pone.0294698,3
