title,authors,publish_date,journal_name,doi,citations
Comparison of community-based HIV counselling and testing (CBCT) through index client tracing and other modalities: Outcomes in 13 South African high HIV prevalence districts by gender and age,"Simukai Shamu, Thato Farirai, Locadiah Kuwanda, Jean Slabbert, Geoffrey Guloba, Sikhulile Khupakonke, Suzanne Johnson, Nomea Masihleho, Julius Kamera, Nkhensani Nkhwashu",published 06 Sep 2019,PLOS ONE,https://doi.org/10.1371/journal.pone.0221215,15
The Impact of Pre-Exposure Prophylaxis (PrEP) on HIV Epidemics in Africa and India: A Simulation Study,"Debby C. J. Vissers, Hélène A. C. M. Voeten, Nico J. D. Nagelkerke, J. Dik F. Habbema, Sake J. de Vlas",published 07 May 2008,PLOS ONE,https://doi.org/10.1371/journal.pone.0002077,108
"Seasonal changes in suicide in South Korea, 1991 to 2015","Chi Ting Yang, Paul S. F. Yip, Eun Shil Cha, Yi Zhang",published 28 Jun 2019,PLOS ONE,https://doi.org/10.1371/journal.pone.0219048,15
Genetic Variability in Markers of HLA-C Expression in Two Diverse South African Populations,"Nikki L. Gentle, Maria Paximadis, Adrian Puren, Caroline T. Tiemessen",published 05 Jul 2013,PLOS ONE,https://doi.org/10.1371/journal.pone.0067780,11
Genetic Divergence Disclosing a Rapid Prehistorical Dispersion of Native Americans in Central and South America,"Yungang He, Wei R. Wang, Ran Li, Sijia Wang, Li Jin",published 06 Sep 2012,PLOS ONE,https://doi.org/10.1371/journal.pone.0044788,3
"Predictors of Treatment Failure among Adult Antiretroviral Treatment (ART) Clients in Bale Zone Hospitals, South Eastern Ethiopia","Demewoz Haile, Abulie Takele, Ketema Gashaw, Habtamu Demelash, Dabere Nigatu",published 07 Oct 2016,PLOS ONE,https://doi.org/10.1371/journal.pone.0164299,33
Optimizing Partner Notification Programs for Men Who Have Sex with Men: Factorial Survey Results from South China,"Alberta L. Wang, Rui-Rui Peng, Joseph D. Tucker, Hrishikesh Chakraborty, Myron S. Cohen, Xiang-Sheng Chen",published 27 Jul 2016,PLOS ONE,https://doi.org/10.1371/journal.pone.0157749,8
Religious Affiliation Modulates Weekly Cycles of Cropland Burning in Sub-Saharan Africa,"José M. C. Pereira, Duarte Oom, Paula Pereira, Antónia A. Turkman, K. Feridun Turkman",published 29 Sep 2015,PLOS ONE,https://doi.org/10.1371/journal.pone.0139189,21
"Diagnostic Accuracy of the HemoCue Hb 301, STAT-Site M","Manjeetha Jaggernath, Rumallen Naicker, Savathree Madurai, Mark A. Brockman, Thumbi Ndung’u, Huub C. Gelderblom",published 05 Apr 2016,PLOS ONE,https://doi.org/10.1371/journal.pone.0152184,26
"Mapping, Bayesian Geostatistical Analysis and Spatial Prediction of Lymphatic Filariasis Prevalence in Africa","Hannah Slater, Edwin Michael",published 12 Aug 2013,PLOS ONE,https://doi.org/10.1371/journal.pone.0071574,47
Next generation sequencing and RNA-seq characterization of adipose tissue in the Nile crocodile (Crocodylus niloticus) in South Africa: Possible mechanism(s) of pathogenesis and pathophysiology of pansteatitis,"Odunayo I. Azeez, Jan G. Myburgh, Ana-Mari Bosman, Jonathan Featherston, Kgomotso P. Sibeko-Matjilla, Marinda C. Oosthuizen, Joseph P. Chamunorwa",published 18 Nov 2019,PLOS ONE,https://doi.org/10.1371/journal.pone.0225073,4
Opportunities within the meat supply chain in Africa—The case of beef production in Northern Ghana,"Áron Vaskó, Imre Vida, László Vasa, Frederick Adzitey",published 18 Jan 2022,PLOS ONE,https://doi.org/10.1371/journal.pone.0260668,4
"Evaluating supply chain management of SARS-CoV-2 point-of-care (POC) diagnostic services in primary healthcare clinics in Mopani District, Limpopo Province, South Africa","Kuhlula Maluleke, Alfred Musekiwa, Tivani Mashamba-Thompson",published 27 Jun 2023,PLOS ONE,https://doi.org/10.1371/journal.pone.0287477,2
Narratives of most significant change to explore experiences of caregivers in a caregiver-young adolescent sexual and reproductive health communication intervention in rural south-western Uganda,"Cecilia Akatukwasa, Elizabeth Kemigisha, Dorcus Achen, Danielle Fernandes, Shakira Namatovu, Wendo Mlahagwa, Gad Ndaruhutse Ruzaaza, Gily Coene, Godfrey Zari Rukundo, Kristien Michielsen, Viola N. Nyakato",published 31 May 2023,PLOS ONE,https://doi.org/10.1371/journal.pone.0286319,1
"Understanding the Relationships between Gender Inequitable Behaviours, Childhood Trauma and Socio-Economic Status in Single and Multiple Perpetrator Rape in Rural South Africa: Structural Equation Modelling","Rachel Jewkes, Mzikazi Nduna, Nwabisa Jama-Shai, Esnat Chirwa, Kristin Dunkle",published 16 May 2016,PLOS ONE,https://doi.org/10.1371/journal.pone.0154903,32
HIV/AIDS Competent Households: Interaction between a Health-Enabling Environment and Community-Based Treatment Adherence Support for People Living with HIV/AIDS in South Africa,"Caroline Masquillier, Edwin Wouters, Dimitri Mortelmans, Brian van Wyk, Harry Hausler, Wim Van Damme",published 10 Mar 2016,PLOS ONE,https://doi.org/10.1371/journal.pone.0151379,30
Interferon signaling in,"Adaeze O. Izuogu, Kristin L. McNally, Stephen E. Harris, Brian H. Youseff, John B. Presloid, Christopher Burlak, Jason Munshi-South, Sonja M. Best, R. Travis Taylor",published 26 Jun 2017,PLOS ONE,https://doi.org/10.1371/journal.pone.0179781,12
Metabolic Parameters and Emotionality Are Little Affected in G-Protein Coupled Receptor 12 (Gpr12) Mutant Mice,"Elisabeth Frank, Yizhen Wu, Naomi Piyaratna, William James Body, Peta Snikeris, Timothy South, Anna-Karin Gerdin, Mikael Bjursell, Mohammad Bohlooly-Y, Leonard Storlien, Xu-Feng Huang",published 07 Aug 2012,PLOS ONE,https://doi.org/10.1371/journal.pone.0042395,6
Estimating the time-varying reproduction number for COVID-19 in South Africa during the first four waves using multiple measures of incidence for public and private sectors across four waves,"Jeremy Bingham, Stefano Tempia, Harry Moultrie, Cecile Viboud, Waasila Jassat, Cheryl Cohen, Juliet R.C. Pulliam",published 22 Sep 2023,PLOS ONE,https://doi.org/10.1371/journal.pone.0287026,0
Integrating gestational diabetes and type 2 diabetes care into primary health care: Lessons from prevention of mother-to-child transmission of HIV in South Africa - A mixed methods study,"Jean Claude Mutabazi, Pascal Roland Enok Bonong, Helen Trottier, Lisa Jayne Ware, Shane A. Norris, Katherine Murphy, Naomi Levitt, Christina Zarowsky",published 22 Jan 2021,PLOS ONE,https://doi.org/10.1371/journal.pone.0245229,5
"Spatial pattern of tuberculosis (TB) and related socio-environmental factors in South Korea, 2008-2016","Changmin Im, Youngho Kim",published 05 Aug 2021,PLOS ONE,https://doi.org/10.1371/journal.pone.0255727,15
"The Impact of Successful Cataract Surgery on Quality of Life, Household Income and Social Status in South India","Robert P. Finger, David G. Kupitz, Eva Fenwick, Bharath Balasubramaniam, Ramanathan V. Ramani, Frank G. Holz, Clare E. Gilbert",published 31 Aug 2012,PLOS ONE,https://doi.org/10.1371/journal.pone.0044268,73
"“She’s gone now.” A mixed methods analysis of the experiences and perceptions around the deaths of children who died unexpectedly in health care facilities in Cape Town, South Africa","Peter Hodkinson, Jessica Price, Caroline Croxson, Lee Wallis, Alison Ward, Andrew Argent, Stephen Reid",published 06 Mar 2019,PLOS ONE,https://doi.org/10.1371/journal.pone.0213455,4
Evidence of rotavirus vaccine impact in sub-Saharan Africa: Systematic review and meta-analysis,"Opolot Godfrey, Weidong Zhang, Cecilia Amponsem-Boateng, Timothy Bonney Oppong, QingLin Zhao, Dankang Li",published 27 Apr 2020,PLOS ONE,https://doi.org/10.1371/journal.pone.0232113,30
Effect of government revenue on economic growth of sub-Saharan Africa: Does institutional quality matter?,"Isubalew Daba Ayana, Wondaferahu Mulugeta Demissie, Atnafu Gebremeskel Sore",published 29 Nov 2023,PLOS ONE,https://doi.org/10.1371/journal.pone.0293847,0
The impact of interventions for the primary prevention of hypertension in Sub-Saharan Africa: A systematic review and meta-analysis,"Akosua A. Wamba, Noah F. Takah, Cathy Johnman",published 19 Jul 2019,PLOS ONE,https://doi.org/10.1371/journal.pone.0219623,12
"Earliest known ophiuroids from high palaeolatitude, southern Gondwana, recovered from the Pragian to earliest Emsian Baviaanskloof Formation (Table Mountain Group, Cape Supergroup) South Africa","Caitlin Reddy, Ben Thuy, Mhairi Reid, Robert Gess",published 25 Oct 2023,PLOS ONE,https://doi.org/10.1371/journal.pone.0292636,1
New species and record of,"Christine Ruta, Davi Moreira Mundim, Roberta Freitas, Rannyele P. Ribeiro",published 23 Oct 2023,PLOS ONE,https://doi.org/10.1371/journal.pone.0293087,0
Worldwide Distribution of the,"Taras K. Oleksyk, George W. Nelson, Ping An, Jeffrey B. Kopp, Cheryl A. Winkler",published 09 Jul 2010,PLOS ONE,https://doi.org/10.1371/journal.pone.0011474,33
Factors associated with common mental health problems of humanitarian workers in South Sudan,"Hannah Strohmeier, Willem F. Scholte, Alastair Ager",published 31 Oct 2018,PLOS ONE,https://doi.org/10.1371/journal.pone.0205333,34
Women’s education and coverage of skilled birth attendance: An assessment of Sustainable Development Goal 3.1 in the South and Southeast Asian Region,"Jahar Bhowmik, Raaj Kishore Biswas, Nurjahan Ananna",published 21 Apr 2020,PLOS ONE,https://doi.org/10.1371/journal.pone.0231489,12
Archaeological expansions in tropical South America during the late Holocene: Assessing the role of demic diffusion,"Jonas Gregorio de Souza, Jonas Alcaina Mateos, Marco Madella",published 27 Apr 2020,PLOS ONE,https://doi.org/10.1371/journal.pone.0232367,21
Structure of sweet potato (,"Kodjo Glato, Atsou Aidam, Ndjido Ardo Kane, Diallo Bassirou, Marie Couderc, Leila Zekraoui, Nora Scarcelli, Adeline Barnaud, Yves Vigouroux",published 26 May 2017,PLOS ONE,https://doi.org/10.1371/journal.pone.0177697,23
Experiences of oral pre-exposure prophylaxis (PrEP) use disclosure among South African adolescent girls and young women and its perceived impact on adherence,"Danielle Giovenco, Katherine Gill, Lauren Fynn, Menna Duyver, Shannon O’Rourke, Ariane van der Straten, Jennifer F. Morton, Connie L. Celum, Linda-Gail Bekker",published 05 Mar 2021,PLOS ONE,https://doi.org/10.1371/journal.pone.0248307,35
Reverse transcription recombinase polymerase amplification assay for rapid detection of canine associated rabies virus in Africa,"Jessica Coertse, Jacqueline Weyer, Louis H. Nel, Wanda Markotter",published 05 Jul 2019,PLOS ONE,https://doi.org/10.1371/journal.pone.0219292,14
High Resolution Mapping of Soil Properties Using Remote Sensing Variables in South-Western Burkina Faso: A Comparison of Machine Learning and Multiple Linear Regression Models,"Gerald Forkuor, Ozias K. L. Hounkpatin, Gerhard Welp, Michael Thiel",published 23 Jan 2017,PLOS ONE,https://doi.org/10.1371/journal.pone.0170478,344
Male Circumcision and the Epidemic Emergence of HIV-2 in West Africa,"João Dinis Sousa, Marina Padrão Temudo, Barry Stephen Hewlett, Ricardo Jorge Camacho, Viktor Müller, Anne-Mieke Vandamme",published 07 Dec 2016,PLOS ONE,https://doi.org/10.1371/journal.pone.0166805,10
The monsoon-associated equine South African pointy mosquito ‘,"Jalil Nejati, Shahyad Azari-Hamidian, Mohammad Ali Oshaghi, Hassan Vatandoost, Vanessa L. White, Seyed H. Moosa-Kazemi, Rubén Bueno-Marí, Ahmad A. Hanafi-Bojd, Nancy M. Endersby-Harshman, Jason K. Axford, Fateh Karimian, Mona Koosha, Nayyereh Choubdar, Ary A. Hoffmann",published 23 May 2024,PLOS ONE,https://doi.org/10.1371/journal.pone.0298412,0
"Health promotion interventions for the control of hypertension in Africa, a systematic scoping review from 2011 to 2021","Jinhee Shin, Kennedy Diema Konlan, Eugenia Mensah",published 29 Nov 2021,PLOS ONE,https://doi.org/10.1371/journal.pone.0260411,5
"Dynamics of Indian Ocean Slavery Revealed through Isotopic Data from the Colonial Era Cobern Street Burial Site, Cape Town, South Africa (1750-1827)","Lisette M. Kootker, Linda Mbeki, Alan G. Morris, Henk Kars, Gareth R. Davies",published 16 Jun 2016,PLOS ONE,https://doi.org/10.1371/journal.pone.0157750,28
"Portable, non-destructive colorimetry and visible reflectance spectroscopy paired with machine learning can classify experimentally heat-treated silcrete from three South African sources","John K. Murray, Simen Oestmo, Andrew M. Zipkin",published 08 Apr 2022,PLOS ONE,https://doi.org/10.1371/journal.pone.0266389,4
Two New Cynodonts (Therapsida) from the Middle-Early Late Triassic of Brazil and Comments on South American Probainognathians,"Agustín G. Martinelli, Marina Bento Soares, Cibele Schwanke",published 05 Oct 2016,PLOS ONE,https://doi.org/10.1371/journal.pone.0162945,46
Prevalence and risk factors for latent tuberculosis infection among household contacts of index cases in two South African provinces: Analysis of baseline data from a cluster-randomised trial,"Peter MacPherson, Limakatso Lebina, Kegaugetswe Motsomi, Zama Bosch, Minja Milovanovic, Andrew Ratsela, Sanjay Lala, Ebrahim Variava, Jonathan E. Golub, Emily L. Webb, Neil A. Martinson",published 17 Mar 2020,PLOS ONE,https://doi.org/10.1371/journal.pone.0230376,22
"Prevalence and associated factors of visual impairment among adult diabetic patients visiting Adare General Hospital, Hawassa, South Ethiopia, 2022","Henok Biruk Alemayehu, Melkamu Temeselew Tegegn, Mikias Mered Tilahun",published 13 Oct 2022,PLOS ONE,https://doi.org/10.1371/journal.pone.0276194,3
Uterine prolapse and associated factors among reproductive-age women in south-west Ethiopia: A community-based cross-sectional study,"Abebe Sorsa Badacho, Mengistu Auro Lelu, Zegeye Gelan, Deginesh Dawit Woltamo",published 21 Jan 2022,PLOS ONE,https://doi.org/10.1371/journal.pone.0262077,8
Characterization of a Monoclonal Antibody Directed against,"Juan Calvo-Iglesias, Daniel Pérez-Estévez, Silvia Lorenzo-Abalde, Beatriz Sánchez-Correa, María Isabel Quiroga, José M. Fuentes, África González-Fernández",published 23 Mar 2016,PLOS ONE,https://doi.org/10.1371/journal.pone.0152210,9
A Conditional Mouse Mutant in the Tumor Suppressor,"África Millán-Uclés, Blanca Díaz-Castro, Paula García-Flores, Alicia Báez, José Antonio Pérez-Simón, José López-Barneo, José I. Piruat",published 20 Jan 2014,PLOS ONE,https://doi.org/10.1371/journal.pone.0085528,16
Facility-Level Factors Influencing Retention of Patients in HIV Care in East Africa,"Beth Rachlis, Giorgos Bakoyannis, Philippa Easterbrook, Becky Genberg, Ronald Scott Braithwaite, Craig R. Cohen, Elizabeth A. Bukusi, Andrew Kambugu, Mwebesa Bosco Bwana, Geoffrey R. Somi, Elvin H. Geng, Beverly Musick, Constantin T. Yiannoutsos, Kara Wools-Kaloustian, Paula Braitstein",published 10 Aug 2016,PLOS ONE,https://doi.org/10.1371/journal.pone.0159994,51
Is self-assessment of medical abortion using a low-sensitivity pregnancy test combined with a checklist and phone text messages feasible in South African primary healthcare settings? A randomized trial,"Deborah Constant, Jane Harries, Kristen Daskilewicz, Landon Myer, Kristina Gemzell-Danielsson",published 22 Jun 2017,PLOS ONE,https://doi.org/10.1371/journal.pone.0179600,16
"Association between viral suppression during the third trimester of pregnancy and unintended pregnancy among women on antiretroviral therapy: Results from the 2019 antenatal HIV Sentinel Survey, South Africa","Selamawit Woldesenbet, Tendesayi Kufa, Samuel Manda, Kassahun Ayalew, Carl Lombard, Mireille Cheyip, Adrian Puren",published 17 Mar 2022,PLOS ONE,https://doi.org/10.1371/journal.pone.0265124,3
Blue mussels of the,"Pablo A. Oyarzún, Jorge E. Toro, José J. Nuñez, Elkin Y. Suárez-Villota, Jonathan P. A. Gardner",published 02 Sep 2021,PLOS ONE,https://doi.org/10.1371/journal.pone.0256961,7
Correction: Quality of service and continuous quality improvement in voluntary medical male circumcision programme across four provinces in South Africa: Longitudinal and cross-sectional programme data,"Tawanda Nyengerai, Motshana Phohole, Nelson Igaba, Constance Wose Kinge, Elizabeth Gori, Khumbulani Moyo, Charles Chasela",published 05 Apr 2024,PLOS ONE,https://doi.org/10.1371/journal.pone.0302097,0
"Knowledge, attitudes and preventive practices towards COVID-19 among workers at two points of entry in South-Eastern Botswana: A cross-sectional study","Keatlaretse Siamisang, Naledi Mokgethi, Onalethata Lesetedi, Mpho Selemogo",published 10 Nov 2022,PLOS ONE,https://doi.org/10.1371/journal.pone.0277506,1
"Availability, cost and affordability of essential cardiovascular disease medicines in the south west region of Cameroon: Preliminary findings from the Cameroon science for disease study","Anastase Dzudie, Epie Njume, Martin Abanda, Leopold Aminde, Ba Hamadou, Bonaventure Dzekem, Marcel Azabji, Marie Solange Doualla, Marcelin Ngowe, Andre P. Kengne",published 04 Mar 2020,PLOS ONE,https://doi.org/10.1371/journal.pone.0229307,17
One-way SMS and healthcare outcomes in Africa: Systematic review of randomised trials with meta-analysis,"Ditte S. Linde, Malene Korsholm, Johnson Katanga, Vibeke Rasch, Andreas Lundh, Marianne S. Andersen",published 06 Jun 2019,PLOS ONE,https://doi.org/10.1371/journal.pone.0217485,39
"Clinical presentations, diagnostics, treatments and treatment costs of children and adults with febrile illness in a tertiary referral hospital in south-eastern Guinea: A retrospective longitudinal cohort study","Manuel Raab, Lisa M. Pfadenhauer, Dansira Doumbouya, Guenter Froeschl",published 10 Jan 2022,PLOS ONE,https://doi.org/10.1371/journal.pone.0262084,5
Environmental Gap Analysis to Prioritize Conservation Efforts in Eastern Africa,"Paulo van Breugel, Roeland Kindt, Jens-Peter Barnekow Lillesø, Michiel van Breugel",published 09 Apr 2015,PLOS ONE,https://doi.org/10.1371/journal.pone.0121444,15
Tobacco Use and Mass Media Utilization in Sub-Saharan Africa,Thomas N. O. Achia,published 23 Feb 2015,PLOS ONE,https://doi.org/10.1371/journal.pone.0117219,22
Predictors of uncircumcised primary school girls’ intention to genital cutting in South Ethiopia: Application of theory of planned behavior,"Solomon Haile, Dawit Sullamo, Tekle Ejajo, Firanbon Teshome, Yohannes Kebede",published 30 Jun 2022,PLOS ONE,https://doi.org/10.1371/journal.pone.0270738,0
Cytokine response in asymptomatic and symptomatic,"Sandrine Lydie Oyegue-Liabagui, Chérone Nancy Mbani Mpega Ntigui, Mérédith Flore Ada Mengome, Lady Charlene Kouna, Nathalie Pernelle Tsafack Tegomo, Neil Michel Longo Pendy, Jean-Bernard Lekana-Douki",published 14 Feb 2023,PLOS ONE,https://doi.org/10.1371/journal.pone.0280818,0
Factors associated with wasting among children under five years old in South Asia: Implications for action,"Kassandra L. Harding, Victor M. Aguayo, Patrick Webb",published 03 Jul 2018,PLOS ONE,https://doi.org/10.1371/journal.pone.0198749,97
Fiscal deficit in sub-saharan Africa: A new intuition from the institution and political drivers,"Ezekiel Olamide Abanikanda, James Temitope Dada, Rotimi Ayoade Ogunjumo",published 08 Sep 2023,PLOS ONE,https://doi.org/10.1371/journal.pone.0291150,2
"High Influenza A Virus Infection Rates in Mallards Bred for Hunting in the Camargue, South of France","Marion Vittecoq, Viviane Grandhomme, Jocelyn Champagnon, Matthieu Guillemain, Bernadette Crescenzo-Chaigne, François Renaud, Frédéric Thomas, Michel Gauthier-Clerc, Sylvie van der Werf",published 27 Aug 2012,PLOS ONE,https://doi.org/10.1371/journal.pone.0043974,17
Access to care solutions in healthcare for obstetric care in Africa: A systematic review,"Anjni Joiner, Austin Lee, Phindile Chowa, Ramu Kharel, Lekshmi Kumar, Nayara Malheiros Caruzzo, Thais Ramirez, Lindy Reynolds, Francis Sakita, Lee Van Vleet, Megan von Isenburg, Anna Quay Yaffee, Catherine Staton, Joao Ricardo Nickenig Vissoci",published 04 Jun 2021,PLOS ONE,https://doi.org/10.1371/journal.pone.0252583,2
"‘What Do I Know? Should I Participate?’ Considerations on Participation in HIV Related Research among HIV Infected Adults in Bangalore, South India","Rashmi J. Rodrigues, Jimmy Antony, Shubha Krishnamurthy, Anita Shet, Ayesha De Costa",published 27 Feb 2013,PLOS ONE,https://doi.org/10.1371/journal.pone.0053054,5
Euros vs. Yuan: Comparing European and Chinese Fishing Access in West Africa,"Dyhia Belhabib, U. Rashid Sumaila, Vicky W. Y. Lam, Dirk Zeller, Philippe Le Billon, Elimane Abou Kane, Daniel Pauly",published 20 Mar 2015,PLOS ONE,https://doi.org/10.1371/journal.pone.0118351,81
Genotyping and Molecular Characterization of Hepatitis B Virus from Human Immunodeficiency Virus-Infected Individuals in Southern Africa,"Euphodia Makondo, Trevor G. Bell, Anna Kramvis",published 28 Sep 2012,PLOS ONE,https://doi.org/10.1371/journal.pone.0046345,42
"Correction: Early mortality in tuberculosis patients initially lost to follow up following diagnosis in provincial hospitals and primary health care facilities in Western Cape, South Africa","Muhammad Osman, Sue-Ann Meehan, Arne von Delft, Karen Du Preez, Rory Dunbar, Florian M. Marx, Andrew Boulle, Alex Welte, Pren Naidoo, Anneke C. Hesseling",published 14 Mar 2024,PLOS ONE,https://doi.org/10.1371/journal.pone.0300768,0
Residency Patterns and Migration Dynamics of Adult Bull Sharks (,"Ryan Daly, Malcolm J. Smale, Paul D. Cowley, Pierre W. Froneman",published 08 Oct 2014,PLOS ONE,https://doi.org/10.1371/journal.pone.0109357,77
"Evaluation of the medically necessary, time sensitive triage score during and beyond the local COVID-19 pandemic in the Gynaecologic Oncology Unit of a tertiary hospital in South Africa","Adekunle Emmanuel Sajo, Arie Mouton, Gbenga Olorunfemi, Visser Cathy, Matthys Cornelis van Aardt, Greta Dreyer",published 13 Apr 2023,PLOS ONE,https://doi.org/10.1371/journal.pone.0284177,0
Prospective acceptability of a multipurpose technology (MPT) implant in preclinical development to prevent HIV and unplanned pregnancy: Qualitative insights from women end users and health care providers in South Africa and Zimbabwe,"Sikhanyisiwe Nkomo, Wanzirai Makoni, Mary Kate Shapley-Quinn, Ellen Luecke, Enough Mbatsane, Kgahlisho Manenzhe, Khatija Ahmed, Leah M. Johnson, Imelda Mahaka, Ariane van der Straten",published 17 May 2023,PLOS ONE,https://doi.org/10.1371/journal.pone.0285711,2
High Rates of Pneumonia in Children under Two Years of Age in a South East Asian Refugee Population,"Claudia Turner, Paul Turner, Verena Carrara, Kathy Burgoine, Saw Tha Ler Htoo, Wanitda Watthanaworawit, Nicholas P. Day, Nicholas J. White, David Goldblatt, François Nosten",published 08 Jan 2013,PLOS ONE,https://doi.org/10.1371/journal.pone.0054026,36
Detection and Localisation of the Abalone Probiotic,"Robert J. Huddy, Vernon E. Coyne",published 22 Jan 2014,PLOS ONE,https://doi.org/10.1371/journal.pone.0086623,14
"Field Evaluation of Malaria Microscopy, Rapid Malaria Tests and Loop-Mediated Isothermal Amplification in a Rural Hospital in South Western Ethiopia","Juan Cuadros, Ramón Pérez-Tanoira, Laura Prieto-Pérez, Ines Martin-Martin, Pedro Berzosa, Vicenta González, Gebre Tisiano, Seble Balcha, José Manuel Ramos, Miguel Górgolas",published 10 Nov 2015,PLOS ONE,https://doi.org/10.1371/journal.pone.0142842,18
Implications of Nubian-Like Core Reduction Systems in Southern Africa for the Identification of Early Modern Human Dispersals,"Manuel Will, Alex Mackay, Natasha Phillips",published 30 Jun 2015,PLOS ONE,https://doi.org/10.1371/journal.pone.0131824,66
Interventions to improve early retention of patients in antiretroviral therapy programmes in sub-Saharan Africa: A systematic review,"Samuel Muhula, John Gachohi, Yeri Kombe, Simon Karanja",published 09 Feb 2022,PLOS ONE,https://doi.org/10.1371/journal.pone.0263663,15
Level of agreement between objectively determined body composition and perceived body image in 6- to 8-year-old South African children: The Body Composition–Isotope Technique study,"Lynn T. Moeng-Mahlangu, Makama A. Monyeki, John J. Reilly, Zandile J. Mchiza, Thabisile Moleah, Cornelia U. Loechl, Herculina S. Kruger",published 10 Aug 2020,PLOS ONE,https://doi.org/10.1371/journal.pone.0237399,5
High risk exposure to HIV among sexually active individuals who tested negative on rapid HIV Tests in the Tshwane District of South Africa—The importance of behavioural prevention measures,"Simnikiwe H. Mayaphi, Desmond J. Martin, Steve A. S. Olorunju, Brian G. Williams, Thomas C. Quinn, Anton C. Stoltz",published 02 Feb 2018,PLOS ONE,https://doi.org/10.1371/journal.pone.0192357,2
"Distribution and molecular characterization of ESBL, pAmpC β-lactamases, and non-β-lactam encoding genes in Enterobacteriaceae isolated from hospital wastewater in Eastern Cape Province, South Africa","Folake Temitope Fadare, Anthony Ifeanyi Okoh",published 21 Jul 2021,PLOS ONE,https://doi.org/10.1371/journal.pone.0254753,28
The effect of mHealth on childhood vaccination in Africa: A systematic review and meta-analysis,"Girma Gilano, Sewunet Sako, Berihun Molla, Andre Dekker, Rianne Fijten",published 21 Feb 2024,PLOS ONE,https://doi.org/10.1371/journal.pone.0294442,0
"Pre- and intra -COVID-19 trends of contraceptive use among women who had termination of pregnancy at Charlotte Maxeke Johannesburg Academic Hospital, Johannesburg South Africa (2010–2020)","Kennedy Baffour-Duah, Gbenga Olorunfemi, Lusanda Shimange-Matsose",published 14 Dec 2022,PLOS ONE,https://doi.org/10.1371/journal.pone.0277911,0
Multilevel predictors of climate change beliefs in Africa,"Juan B. González, Alfonso Sánchez",published 05 Apr 2022,PLOS ONE,https://doi.org/10.1371/journal.pone.0266387,4
Adaptive Evolution of the,"Rasika A. Mathias, Wenqing Fu, Joshua M. Akey, Hannah C. Ainsworth, Dara G. Torgerson, Ingo Ruczinski, Susan Sergeant, Kathleen C. Barnes, Floyd H. Chilton",published 19 Sep 2012,PLOS ONE,https://doi.org/10.1371/journal.pone.0044926,91
